text,date,category
iran families left homeless earthquake huddle around fires warmth sleep tents,16_11_2017,affected_individuals
iran families left homeless earthquake huddle around fires warmth sleep tents,16_11_2017,affected_individuals
iran families left homeless earthquake huddle around fires warmth sleep tents,16_11_2017,affected_individuals
iran families left homeless earthquake huddle around fires warmth sleep tents,16_11_2017,affected_individuals
new earthquake leaves casualties iran,16_11_2017,other_relevant_information
strong earthquake iran effect yesterdays earthquake azerbaijan,16_11_2017,other_relevant_information
city turned rubble still beautiful earthquake iran kermanshah photo someiraz,16_11_2017,other_relevant_information
irans mullah regime imposes new measures quell earthquake victims,16_11_2017,affected_individuals
iran turning blind eye kurdish victims earthquake basnews,16_11_2017,affected_individuals
south koreans stay shelters powerful quake bearday iran usa,16_11_2017,other_relevant_information
iran turns offers earthquake aid including archfoe israel,16_11_2017,rescue_volunteering_or_donation_effort
foxalgeria criticism us sanctions returns iran earthquake algerie,16_11_2017,other_relevant_information
researcher claims predicted iraniraqearthquake planetary alignments,16_11_2017,other_relevant_information
earthquake kermanshah irans new genocide religious ethnic minorities,16_11_2017,other_relevant_information
weeks quoteoftheweek comes maryamrajavi last weeks tragic earthquake iran freeiran,16_11_2017,other_relevant_information
iran factions use earthquake relief effort pursue power struggle,16_11_2017,other_relevant_information
copernicusems activated monitor impact earthquake iraq,16_11_2017,other_relevant_information
pak top politician expresses sorrow iran killer earthquake,16_11_2017,not_humanitarian
private message israel israel offer medical aid victims earthquake,16_11_2017,rescue_volunteering_or_donation_effort
huge earthquake could strike today says prophet predicted iraniraq killer quake,16_11_2017,other_relevant_information
act alliance alert iraq earthquake reliefweb hng earthquake,16_11_2017,other_relevant_information
iraqiran earthquake italianairforce provides aid avgeek aviation,16_11_2017,rescue_volunteering_or_donation_effort
iran earthquake survivors sleeping rubble ask help washington post iran,16_11_2017,affected_individuals
crowdfunding raise funds irans recent earthquake crowdfunding startup tech,16_11_2017,rescue_volunteering_or_donation_effort
us embassy shows reality devastating earthquake hitting iraq iran,16_11_2017,other_relevant_information
iran earthquake appeal,16_11_2017,other_relevant_information
fundraising irans earthquake victims blocked us treasury,16_11_2017,rescue_volunteering_or_donation_effort
man plays piano ruins house city hit earthquake leaving dead iran,16_11_2017,infrastructure_and_utility_damage
know iran turning internationa assistance earthquake area read,16_11_2017,not_humanitarian
airlifts medical supplies treat wounded iraniraq earthquake,16_11_2017,rescue_volunteering_or_donation_effort
sweet moment little kid helps friend get food devastating earthquake,16_11_2017,not_humanitarian
iran used haarp technology caused earthquake kurdistan,16_11_2017,not_humanitarian
iranian regime tries cover devastating reality earthquake disaster,16_11_2017,other_relevant_information
baby rescued rubble hours earthquake iran life must go,16_11_2017,rescue_volunteering_or_donation_effort
iran mullahs priority cover dimensions disaster prevent popular protests earthquake areasiran,17_11_2017,not_humanitarian
netanyahu says iran rejected israels offer aid devastating earthquake haaretzcom says false,17_11_2017,rescue_volunteering_or_donation_effort
iran shock trauma crisis christiannews earthquake,17_11_2017,other_relevant_information
people sarabzahab village building shelter destructive earthquake western iran,17_11_2017,infrastructure_and_utility_damage
pics recent iran earthquake worth thousand words photo source amp credit unknown,17_11_2017,other_relevant_information
iran earthquake damage put bn pounds international paologentiloni,17_11_2017,infrastructure_and_utility_damage
week pictures iran earthquake greece floods barcelona kabul,17_11_2017,not_humanitarian
iranian little boy takes friend receive food irans earthquake,17_11_2017,rescue_volunteering_or_donation_effort
rouhani vs ahmadinejad pictures speak volume iran earthquake,17_11_2017,not_humanitarian
rouhani vs ahmadinejad pictures speak volume iran earthquake,17_11_2017,other_relevant_information
rouhani vs ahmadinejad pictures speak volume iran earthquake,17_11_2017,not_humanitarian
rouhani vs ahmadinejad pictures speak volume iran earthquake,17_11_2017,other_relevant_information
iranearthquake tidal wave solidarity iran prayforiran,17_11_2017,other_relevant_information
testing atomic really earthquake think iran,17_11_2017,other_relevant_information
moments peace lake outside halabja shaken last weeks earthquake,17_11_2017,not_humanitarian
irans former president ahmadinejad visits villages struck earthquake kermanshah,17_11_2017,other_relevant_information
irans former president ahmadinejad visits villages struck earthquake kermanshah,17_11_2017,other_relevant_information
irans former president ahmadinejad visits villages struck earthquake kermanshah,17_11_2017,other_relevant_information
premium times buhari commiserates iran iraq earthquake afropagesen,17_11_2017,not_humanitarian
huge earthquake west iran city many villages collapsed,17_11_2017,infrastructure_and_utility_damage
pakistan dispatches relief assistance earthquake affectees iran,17_11_2017,rescue_volunteering_or_donation_effort
unsafe building earthquake result west iran,17_11_2017,infrastructure_and_utility_damage
reading recent earthquake iran currentevents newsela,17_11_2017,not_humanitarian
reading recent earthquake iran currentevents newsela,17_11_2017,not_humanitarian
world red cross netanyahus claim false iran wanted help earthquake victims,17_11_2017,not_humanitarian
world red cross netanyahus claim false iran wanted help earthquake victims,17_11_2017,not_humanitarian
israel offers aid iran following massive earthquake freedomfamily beshoyboy,17_11_2017,rescue_volunteering_or_donation_effort
ancient artifacts saved deadly earthquake hold clues mysteries iraqs past,17_11_2017,not_humanitarian
irans regime threat citizens suffering earthquake,17_11_2017,other_relevant_information
sanders calls sanctions relief assist iran earthquake recovery,17_11_2017,rescue_volunteering_or_donation_effort
treasury issues guidance humanitarian donations iran wake earthquake,17_11_2017,rescue_volunteering_or_donation_effort
earthquake qir karzin county fars province iran kamran adl,17_11_2017,other_relevant_information
peterharley sufrogfoot planesonthenet intelcrab tukish aid iraqs earthquake,17_11_2017,not_humanitarian
iraniraq earthquake sentinel copenricus sentinel data esa snap,18_11_2017,other_relevant_information
less hours earthquake hit iraq mobile teams provided lifesaving nilimajumder,18_11_2017,rescue_volunteering_or_donation_effort
less hours earthquake hit iraq mobile teams provided lifesaving nilimajumder,18_11_2017,rescue_volunteering_or_donation_effort
minago earthquake hit kerman iran km gmt emsc,18_11_2017,other_relevant_information
ioc voices readiness help earthquakeaffected people western iran,18_11_2017,rescue_volunteering_or_donation_effort
damage proxy maps cities near epicenter kermanshah earthquake iran tokyotechen,18_11_2017,infrastructure_and_utility_damage
iran daily us treasury blocks donations earthquake survivors,18_11_2017,rescue_volunteering_or_donation_effort
kurdish childrens situation earthquake iran tent house,18_11_2017,affected_individuals
irans earthquake exposes political rifts ineffective governance,18_11_2017,other_relevant_information
victims last weeks earthquake gather outdoors near fire sarpole zahab iran pouria pakizehepa,18_11_2017,affected_individuals
